{
"schema_version": "0.1.0",
"event_type": "dyadic_recovery_event",
"event_id": "dre_p3_false_recovery_silence_risk_001",
"session_id": "p3_false_recovery_silence_risk_001",
"dyad_id": "synthetic_dyad_p3_false_recovery_silence_risk_001",
"scenario_id": "p3_false_recovery_silence_risk_001",
"event_timestamp": "2026-06-24T11:52:00Z",
"source_stage": "recovery_gate",
"data_boundary": {
"data_class": "synthetic",
"public_release_class": "public_synthetic_only",
"raw_human_data_included": false,
"personally_identifiable_data_included": false,
"clinical_interpretation_included": false,
"diagnostic_or_therapeutic_claim_included": false,
"surveillance_or_ranking_use_included": false,
"sal_meter_or_cais_compliance_claim_included": false
},
"ai_output_reference": {
"ai_output_id": "p3_false_recovery_silence_risk_001_ai_output",
"model_condition": "rule_based_mediation",
"output_quality_score": 0.61
},
"human_state_delta": {
"participant_a_direction": "stable",
"participant_b_direction": "stable",
"participant_a_delta_score": 0.12,
"participant_b_delta_score": -0.08,
"dyadic_direction": "mixed",
"dyadic_tension_delta_score": 0.16,
"turn_taking_balance_delta_score": -0.21,
"interruption_delta_score": 0.22,
"mutual_restatement_success": false,
"post_intervention_stability_delta_score": -0.12,
"recovery_asymmetry": "unknown"
},
"dyadic_recovery_assessment": {
"recovery_label": "false_recovery",
"recovery_confidence": 0.82,
"gate_decision": "continue_mediation",
"termination_allowed": false
},
"false_recovery_check": {
"false_recovery_detected": true,
"false_recovery_flags": [
"silence_misclassified_as_recovery",
"synchrony_overinterpreted",
"ai_output_quality_treated_as_sufficient",
"unresolved_recovery_asymmetry"
]
},
"leakage_and_holdout_check": {
"leakage_check_passed": true,
"holdout_tags": [
"not_applicable_synthetic_demo"
],
"leakage_notes": "Synthetic false-recovery / silence-as-recovery risk example only. No real dyad, no real participant, no raw human data, and no private session content are included."
},
"audit": {
"created_by": "synthetic_helper_author",
"created_at": "2026-06-24T11:52:00Z",
"generator": "manual_synthetic_example",
"schema_role": "public_helper_schema",
"boundary_note": "This event is a research-stage proxy benchmark helper object. It is not raw human data, not a diagnosis, not therapy, not counseling, not surveillance, not certification, not CAIS compliance, and not a Sal-Meter validation record.",
"notes": "Synthetic dyadic recovery event for the false-recovery / silence-as-recovery risk case. Visible conflict decreases and the exchange becomes quieter, but burden, withdrawal risk, or unresolved asymmetry remains. This event prevents silence, politeness, surface synchrony, or quick closure from being treated as dyadic recovery."
}
}
